{
  "document_type": "rtl-advisor.workflow.request",
  "input": {
    "compile_context_hash": "956b42af0e190b626e27ce831b9a6d63a8290bfaec1f3e5321099f1f87a8acd8",
    "defines": [],
    "include_dirs": [],
    "kind": "generated_rtl",
    "path": "/Users/peter/Desktop/rtl-advisor/experiments/plugin-abc-v1/cases/generated/g07_width_truncation.sv",
    "sha256": "fb0edeead88d4382e1ccb2d1fe79bc76dc62a7c6c6d7f57540c5a6033f7f93a2",
    "top": "g07_width_truncation"
  },
  "objective": "balanced",
  "schema": "rtl-advisor-workflow-request-v1",
  "schema_version": 1,
  "semantic_hash": "37b5b4c3510c754735c8dbe3fd4c93b91a29c6fc7d5303091e3f66ac7ba7299d",
  "workflow_id": "workflow-a4cbc92845fb7f1d143c"
}
