{
  "document_type": "rtl-advisor.workflow.request",
  "input": {
    "compile_context_hash": "e8e0ced43c060a7742d7943037dd4ef758960e92c4d7b56395ec2cb3f096d385",
    "defines": [],
    "include_dirs": [],
    "kind": "explicitly_approved_open_rtl",
    "path": "/Users/peter/Desktop/rtl-advisor/corpus/upstream/common_cells/src/stream_mux.sv",
    "sha256": "865fe908c738eb54ad1721666d877a1cccb698f975fbd3385f71b948426d245f",
    "top": "stream_mux"
  },
  "objective": "balanced",
  "schema": "rtl-advisor-workflow-request-v1",
  "schema_version": 1,
  "semantic_hash": "f40713b0ed93247d254895b3568322ae4e9335097efc7f072fc83d3af36ac213",
  "workflow_id": "workflow-157cdc77a5cbfa547a09"
}
