{
  "document_type": "rtl-advisor.workflow.request",
  "input": {
    "compile_context_hash": "2d5fd630730b60c42a41d58061dcf4e261edb07163f66044ab031448e59896a0",
    "defines": [],
    "include_dirs": [],
    "kind": "explicitly_approved_open_rtl",
    "path": "/Users/peter/Desktop/rtl-advisor/corpus/upstream/verilog-axis/rtl/axis_pipeline_fifo.v",
    "sha256": "a7cdccbf905c3f95d4a626fe77d84879a09c3f472dffc5ea2eb7acc9ba113c02",
    "top": "axis_pipeline_fifo"
  },
  "objective": "balanced",
  "schema": "rtl-advisor-workflow-request-v1",
  "schema_version": 1,
  "semantic_hash": "0b0d6457adc967fe9b072f0c6636092b76f85927f9959ceb963f181b79fe3f1f",
  "workflow_id": "workflow-97160b65942e60847789"
}
